{
  "career_summary": "Focus on building foundational machine learning knowledge and practical project experience using Python and data manipulation libraries to bridge the gap toward a Machine Learning Engineer role.",
  "current_level": "Entry-level",
  "skill_gaps": [
    {
      "skill": "Statistics",
      "priority": "critical",
      "reason": "Statistics forms the mathematical foundation required to understand data distributions, evaluate model performance, and make data-driven decisions during feature engineering. Without a strong grasp of statistical concepts, an engineer cannot effectively validate hypotheses or diagnose why a model fails in production."
    },
    {
      "skill": "Scikit-learn",
      "priority": "critical",
      "reason": "Scikit-learn is the industry-standard library for implementing traditional machine learning algorithms, data preprocessing, and model evaluation pipelines. Mastery of this tool is essential for quickly prototyping, training, and deploying baseline models before moving to more complex architectures."
    },
    {
      "skill": "Deep Learning",
      "priority": "critical",
      "reason": "Deep learning is crucial for solving complex, high-dimensional problems involving unstructured data such as images, audio, and natural language. A Machine Learning Engineer must understand these neural network architectures to build state-of-the-art predictive systems."
    },
    {
      "skill": "PyTorch",
      "priority": "nice-to-have",
      "reason": "PyTorch is one of the leading frameworks for researching and building dynamic deep learning models due to its flexibility and intuitive pythonic design. Knowing this framework allows engineers to efficiently implement, debug, and scale advanced neural networks for production environments."
    },
    {
      "skill": "MLOps",
      "priority": "nice-to-have",
      "reason": "MLOps bridges the gap between model development and operational deployment by automating pipelines for continuous integration, monitoring, and retraining. Having this skill ensures that machine learning models remain reliable, scalable, and performant over time in real-world production systems."
    }
  ],
  "roadmap": [
    {
      "phase_number": 1,
      "phase_name": "Fundamentals",
      "skills": [
        "Statistics"
      ],
      "goal": "Build the core mathematical and statistical foundation required to understand data distributions and evaluate model performance."
    },
    {
      "phase_number": 2,
      "phase_name": "Intermediate Skills",
      "skills": [
        "Scikit-learn"
      ],
      "goal": "Master traditional machine learning algorithms, data preprocessing, and baseline model evaluation pipelines."
    },
    {
      "phase_number": 3,
      "phase_name": "Advanced Skills",
      "skills": [
        "Deep Learning",
        "PyTorch"
      ],
      "goal": "Gain expertise in complex neural network architectures and leading deep learning frameworks to solve high-dimensional problems."
    },
    {
      "phase_number": 4,
      "phase_name": "Projects",
      "skills": [
        "MLOps"
      ],
      "goal": "Apply learned concepts to build, scale, and automate reliable machine learning pipelines for real-world production environments."
    },
    {
      "phase_number": 5,
      "phase_name": "Job Preparation",
      "skills": [],
      "goal": "Consolidate your technical skills and portfolio projects to successfully interview for Machine Learning Engineer positions."
    }
  ],
  "recommended_resources": [
    {
      "skill": "Scikit-learn",
      "resource_name": "scikit-learn Official User Guide",
      "resource_url": "https://scikit-learn.org/stable/user_guide.html",
      "resource_type": "documentation"
    },
    {
      "skill": "Scikit-learn",
      "resource_name": "Kaggle Learn - Intro to Machine Learning",
      "resource_url": "https://www.kaggle.com/learn/intro-to-machine-learning",
      "resource_type": "course"
    },
    {
      "skill": "Scikit-learn",
      "resource_name": "Kaggle Competitions",
      "resource_url": "https://www.kaggle.com/competitions",
      "resource_type": "practice"
    },
    {
      "skill": "Deep Learning",
      "resource_name": "Practical Deep Learning (fast.ai, free)",
      "resource_url": "https://course.fast.ai/",
      "resource_type": "course"
    },
    {
      "skill": "Deep Learning",
      "resource_name": "Kaggle Learn - Intro to Deep Learning",
      "resource_url": "https://www.kaggle.com/learn/intro-to-deep-learning",
      "resource_type": "course"
    },
    {
      "skill": "Deep Learning",
      "resource_name": "Kaggle Competitions",
      "resource_url": "https://www.kaggle.com/competitions",
      "resource_type": "practice"
    },
    {
      "skill": "PyTorch",
      "resource_name": "PyTorch Official Tutorials",
      "resource_url": "https://pytorch.org/tutorials/",
      "resource_type": "documentation"
    },
    {
      "skill": "PyTorch",
      "resource_name": "PyTorch Learn the Basics (interactive)",
      "resource_url": "https://pytorch.org/tutorials/beginner/basics/intro.html",
      "resource_type": "practice"
    },
    {
      "skill": "PyTorch",
      "resource_name": "PyTorch Examples (official repo)",
      "resource_url": "https://github.com/pytorch/examples",
      "resource_type": "practice"
    },
    {
      "skill": "MLOps",
      "resource_name": "Google Cloud MLOps Guide",
      "resource_url": "https://cloud.google.com/architecture/mlops-continuous-delivery-and-automation-pipelines-in-machine-learning",
      "resource_type": "documentation"
    },
    {
      "skill": "MLOps",
      "resource_name": "Made With ML (free MLOps course)",
      "resource_url": "https://madewithml.com/",
      "resource_type": "course"
    },
    {
      "skill": "MLOps",
      "resource_name": "Project Ideas (filter: MLOps)",
      "resource_url": "https://roadmap.sh/projects",
      "resource_type": "practice"
    },
    {
      "skill": "Statistics",
      "resource_name": "Khan Academy Statistics & Probability",
      "resource_url": "https://www.khanacademy.org/math/statistics-probability",
      "resource_type": "course"
    },
    {
      "skill": "Statistics",
      "resource_name": "Khan Academy Practice Exercises (same course)",
      "resource_url": "https://www.khanacademy.org/math/statistics-probability",
      "resource_type": "practice"
    },
    {
      "skill": "Statistics",
      "resource_name": "Kaggle Datasets (apply statistics to real data)",
      "resource_url": "https://www.kaggle.com/datasets",
      "resource_type": "practice"
    }
  ],
  "resume_improvements": [
    "Add a dedicated 'Experience' section to document the candidate's 1.5 years of professional background, including job titles, company names, dates, and detailed bullet points.",
    "Add an 'Education' section to specify the candidate's academic credentials and degree.",
    "Include a 'Projects' section with descriptions of how Python, SQL, and Pandas were applied to solve specific problems, since the current profile lacks descriptive project work."
  ]
}